tokens,neg_score,neu_score,pos_score
game vừa hay và giải trí nên cho,0.21524605225588,0.43218467169098124,0.3525692760531387
đức rất tốt ý nghĩa đ giá bán chung cư dương,0.22059646352507553,0.23337550654961414,0.5460280299253103
ôi tôi thích trò này mn tải thử trải nghiệm nhé,0.18014419977336224,0.28832628518021197,0.5315295150464258
chua choi nhung cho s luôn,0.32380792449698,0.35426293190710745,0.3219291435959127
đúng là một game hay,0.22929950968204302,0.4039181586762718,0.3667823316416851
tót lém tui rát like vì game,0.2727407506043147,0.38998947540013923,0.33726977399554614
rất vui nha nên thử nha mọi người,0.22029813021677735,0.43566957952511276,0.3440322902581099
hay tôi thấy game rất hay,0.24779832798388815,0.28960740998888296,0.4625942620272288
rất hay cho sao nhưng không đăng nhập không có hủng long,0.3330053771938334,0.34195851907047553,0.3250361037356911
game siêu hay luôn mong cập nhật thêm ví dụ như chọn địa điểm các bạn phải chơi lâu chừng phút r chạy nhanh giảm số tiền mua xu và tặng nhiều quà cho người chơi nếu phá kỉ,0.23629717423068164,0.443263209431532,0.32043961633778634
chạy nhanh nhẹn có thể chơi lúc buồn,0.3697806188262631,0.27688778084556254,0.35333160032817434
game hay nên tải về trải nghiệm ngay và luôn không cần đọc bình luận nhảm nhí vì những lời nói không có thật hết,0.18832608943253934,0.4531331464054298,0.35854076416203084
tại sao lại có game như thế này thật tuyệt vời,0.20502013455405058,0.3236366941507824,0.47134317129516695
tuyệt vời quá có thể ra hơn k rất hài lòng,0.1516232180024966,0.12430034969337958,0.7240764323041238
gam rất tốt và túi rất thích nên tui đánh giá sao,0.16872413303132547,0.225042972755778,0.6062328942128964
game này rất hay nên chơi,0.18869371619869085,0.38041222078201864,0.43089406301929056
rat rat rat la ban vao hai cai la co gian,0.2454817532155942,0.34668107401922066,0.40783717276518516
cảm giác rất tiện lợi,0.2879578908708456,0.19287174902880852,0.5191703601003459
đẹp động nhưng tải hơi lâu đôi khi đang chơi nó bị gi gi ấy,0.3400117603124776,0.3463863138932393,0.31360192579428325
tôi đã chơi thử game này chơi rất tốt,0.18583371157031991,0.33774485496172413,0.47642143346795607
hay nhung dan đâu vao choi dan thi,0.27870859148390603,0.3991322902551761,0.3221591182609179
hay cố gắng tốt như vậy nhé,0.17669915765398303,0.30653619080670313,0.5167646515393138
rất thú vị và chúng ta có thể khám phá được nhiều nơi trên thế giới xung quanh chúng ta qua những màn ảnh đẹp đẻ trong trò chơi chung là trò chơi rất tuyệt vời,0.16180874444402607,0.2962344651103248,0.5419567904456493
hay quá cảm ơn nhà sản xuất đã ra trò tuyệt vời ngư thế này trân thành cảm ơn,0.18143541096714236,0.2536382107691019,0.5649263782637556
game tuổi thơ giờ vẫn đỉnh score cao nhất của tôi là k,0.27515200188544975,0.30677658017637366,0.4180714179381766
minh choi phan da roi tai ve hay gap,0.32621001530811444,0.3376820977756114,0.33610788691627413
tai vi no lai rat la vui,0.2417601425110326,0.3414770027167987,0.41676285477216873
ăn xu mới hay h ăn xu là non quá non ai còn ăn xu thì tao xin phép gọi là gà công nghiệp nờ on,0.4168649612945426,0.2654468291468843,0.3176882095585732
tôi thấy rất vui và thú vị cái này làm cho tôi thoải mái khi tôi đi học về,0.3102368033973596,0.25022344367139515,0.4395397529312453
ra bs giờ em chơi vui không e a cũng vậy mà em có đi đâu mà chơi vui không e a cũng vậy mà em có đi đâu mà êu của mình mà thôi kệ a đi ngủ đi nhé đừng là em thôi em nhé anh em không thể tin được không anh ạ a ngủ sớm nha ế là xu ngố cũng có rất rõ là người chưa,0.2605323541477933,0.4036342395374075,0.33583340631479924
tôi thích trò này lắm nó cho ta sự nhanh nhẹ của mình đó hãy thử đi nhé,0.2260614525396538,0.3448458585205696,0.42909268893977676
game chơi khá là hay,0.1806844591023692,0.41990334315615535,0.3994121977414754
hay cực mọi người về chơi đi,0.2536590435743343,0.43619974415459245,0.3101412122710734
game gì thay hay quá,0.287263511813033,0.21522788180909494,0.49750860637787203
nó rất hay và thứ vị,0.21399052782624958,0.22666500639363585,0.5593444657801147
game chơi rất hay và vui,0.1609200764274872,0.29888345213602957,0.5401964714364833
game rất hay đáng sao,0.2570814840640115,0.2850156759604804,0.4579028399755081
game rất hay có ai chạy được mấy chục triệu chưa,0.21361997765408702,0.40209942871341803,0.3842805936324949
rất hay đánh giá sao nhé,0.21225418209012237,0.3707160438160882,0.4170297740937894
không hay luôn,0.3868326628141764,0.30070108241883836,0.31246625476698514
chay rat nhanh ma con nhay nua qua ma thang be kia co,0.3181394127542713,0.2993037531713478,0.3825568340743808
khánh hà rất vui vì được,0.2685234419575154,0.24754712010433289,0.4839294379381517
game rat hay cho nen tui cho s,0.30541743658487125,0.36280843831701515,0.3317741250981136
game này chơi rất vui nên tôi rất thích,0.18686813384564305,0.3001302535802489,0.5130016125741081
hay qua tôi đa một lan chơi ơ may ban tôi thật su rất hay va tuyệt vời,0.23742853927949992,0.1776083993621299,0.5849630613583703
game hay luôn có cập nhật mới,0.2604978324682581,0.41445533226146125,0.32504683527028067
tuyệt vời nhưng mong có thêm nhiều skin hơn nữa nha,0.20954563493637815,0.2873155849140555,0.5031387801495663
trai cua toi rat thích sao,0.352632811096856,0.27490776874320294,0.3724594201599411
chơi rất nhưng k như ý muốn,0.29710231661328773,0.3528708462886425,0.35002683709806964
game nay rat la hay rat,0.19342450731895086,0.24050704459241132,0.5660684480886379
vui không tai ve được,0.39164279163450794,0.2803971550210166,0.3279600533444755
hay mà nhân vật mắt,0.2952113909525944,0.3181354828809963,0.3866531261664093
nó rất hay và đẹp,0.14060352514408056,0.17751917256315522,0.6818773022927643
game rat hay va bo phan xa nhanh nhanh,0.32993755315512224,0.22393040841602654,0.44613203842885124
chơi rất vui cảm nghĩ của tôi rất thích điểm điểm bất ngờ chưa ông bà già,0.28062392000694125,0.24752822486641735,0.47184785512664135
mong ad thêm tính năng đăng nhập để lưu nhân vật và ván cũng như tiền và khoá đi ạ,0.27658876949245315,0.347524051174917,0.3758871793326298
trò chơi này rất hay tôi đánh giá sao luôn,0.2950418529168376,0.34977422109860734,0.35518392598455506
với mình đây có lẽ là game offline hay nhất thế giới cảm ơn đã tạo ra game này,0.23216048668698594,0.3738414715096146,0.3939980418033995
tui nghiện chò chơi này nó rất hay cảm ơn,0.2064645942027383,0.2964341533541629,0.4971012524430987
ai tải về chơi đi chơi hay lắm tải về chơi đi chơi cho đã game này hết hót thế giới đó game này hot thế giới việt nam luôn game này em này đã lắm game này đã lắm ai tải qua đi chơi đã sướng tay luôn xe ta vô tay luôn game này chưa hay lắm hãy tải về chơi đi tôi hay cười luôn hãy chụp kỷ luôn hot nhất thế giới đó game này hot nhất thế giới đó đúng không các o,0.20976400945252682,0.38139604038799024,0.40883995015948293
trò chơi rất hay đó,0.2161485183101535,0.3387871216541093,0.4450643600357373
tro nay choi rat la vui,0.26372609947961295,0.23727402369919018,0.49899987682119684
trò chơi rất hay nhưng các con trong shop đắt quá mua không đủ tiền và tui thích tiếng việt hơn,0.3367300364474534,0.34259850411492204,0.3206714594376245
tôi thấy game rất hay kịch tích có nhiều nhân vật và trang phục đẹp,0.18711996982468865,0.29781931394941036,0.515060716225901
on mt note,0.17323530165953285,0.3883152228968763,0.4384494754435907
game này rất là hay mình nghĩ nên tải nó về nhe,0.15048112848401557,0.41512673314784176,0.43439213836814267
tôi đã tung choi trò chơi này nó rất hay,0.3084484188002262,0.2115175272446367,0.4800340539551371
trò này làm cho tôi rất vui tôi rất thích chơi trò này rất vui mội người nhớ chơi nhé tôi không biết cho máy sao tôi cho năm sao nha,0.33200840406492277,0.30077539290139327,0.367216203033684
bản cập nhật này tạm được mong game phát triển tốt hơn,0.2924049871450503,0.39295704060143705,0.31463797225351275
game nay choi g tai ve di ban se nhan vat hay nhất hay sang choi roi,0.26761398018930327,0.32596695005172316,0.40641906975897363
game hay lắm các bạn ơi,0.1613530624800351,0.4611490782436775,0.3774978592762875
s tỷ tu gs được trẻ hưu du được u kg ii,0.3247740163687612,0.32058951184105033,0.35463647179018853
hay quá cho luôn d,0.2748969315767609,0.17213304361028584,0.5529700248129532
hay hãy hay good like yêu thích nhất,0.17081512931079568,0.1881214962027496,0.6410633744864549
game này rất hay trong lúc tôi đang mệt thì tôi chơi game này thì tôi thấy khỏe lên hẳn,0.39138683421138354,0.27231118832142953,0.336301977467187
nó có nhiều nhân vật với lại nhanh nữa,0.23404784925047603,0.42688107134514247,0.3390710794043814
game chơi rất hay nhưng có một điều mà mình bức xúc là khi đang chơi mà có quảng cáo mong bạn sửa lỗi này nhé,0.19242884727854334,0.45238329053850695,0.35518786218294973
ứng dụng này rất hay luôn,0.297515096136762,0.14848222237123174,0.5540026814920063
game rất hay chơi cái là nghiện luôn,0.22821436084324462,0.3021392847829116,0.4696463543738439
tai ve ba con,0.2961702122270963,0.33816844104132704,0.36566134673157674
z là ta cũng đã bún cánh tay của nha u,0.24976388909271213,0.43950046156867306,0.3107356493386147
game này chơi rất hay và nhạc rất hay,0.21230379214676884,0.24734230742845684,0.5403539004247743
tuyệt khi cập nhập h không ăn vàng thoải mái,0.24545998960601798,0.270862063913118,0.4836779464808639
nó chơi rất hay và hấp dẫn,0.1438041943083594,0.3214640384951293,0.5347317671965114
game vui noi chung là ok,0.2690223219597773,0.274482784244754,0.45649489379546865
rất hay đề nghị ra thêm ván mới đẹp hơn,0.18500605671359263,0.22398256948051448,0.5910113738058927
tóm chung là hay giải trí tuyệt vời,0.1982914305984179,0.16226279345121783,0.6394457759503642
tôi đã mê trò này từ hồi nhỏ và trò,0.3267146334346136,0.3506312639979456,0.32265410256744076
ưa hay luôn em la fan day,0.30132773074974656,0.2196157026248644,0.47905656662538915
rat hay hay tai ve choi nha PROFANE ban,0.24276105145900453,0.31143252201909266,0.44580642652190283
tui rất là nó good,0.1726762264844907,0.23998016850185724,0.587343605013652
hay và nó cũng là game tuổi thơ của t,0.2613182564573365,0.3716178359757174,0.36706390756694607
trò này rất vui mình được k vàng luôn hãy tải game này đi rất hay luôn,0.23226922512193263,0.20565000554979673,0.5620807693282706
rất hay nhưng mong đổi sang hình khác,0.2900867728359294,0.2559895447216294,0.4539236824424414
rất hay skin đẹp mới mẻ chơi rất mượt nên cho sao,0.16817942844540884,0.2025327908346152,0.6292877807199758
game này rất hay các bạn nên tải về và chơi đi,0.1498779250755309,0.4307596499392942,0.41936242498517495
em tên là diệu lớp d trường bắc thăng long thật sự em thấy game rất hay không chê vào đâu được em chẳng biết nói gì hơn bởi vì những lời khen của anh toàn lớp a trường bắc thăng long đã nói hết phần em luôn rồi mong cho game ngày càng phát triển ạ,0.20745635745509877,0.3457291890095697,0.44681445353533156
nó rất vui và vui,0.23692359243423047,0.2090860958438681,0.5539903117219013
cái này hay lắm cài thử đi,0.30442677713141936,0.29021710326986105,0.4053561195987196
game rất hay và giải trí nên tôi cho sao,0.2609957752924622,0.3574578129010441,0.38154641180649357
trò chơi rất bay và giảm căng thẳng,0.2596362988947863,0.324835068723414,0.4155286323817997
trò chơi này tôi thích mà sao cài đặt lâu thế này k biết nữa trời,0.33856560099134086,0.30797281635456997,0.3534615826540892
thôi ạ ứng dụng giải trí rất hay nhưng phải chạy quài,0.3101164337153924,0.23407690629112388,0.45580665999348374
game có tính chất giải trí hay nên t xoá,0.18901511803828672,0.46504950980608234,0.345935372155631
vui chơi giải trí có một người,0.22547286639551878,0.40577187475731163,0.36875525884716964
toi rất thích trò chơi này nhung no có nhiều thứ cản đường tôi đi,0.2553550766433111,0.3457329453876486,0.3989119779690403
tai di PROFANE ban nhe,0.26809078439205564,0.32628265674453144,0.405626558863413
tụi mày có bị ngu không máy tụi mày cùi chơi éo được game la biết ok,0.3392981661555063,0.31188998114130295,0.34881185270319076
ngay nao cung choi very good,0.21746805456586263,0.2848753183129262,0.4976566271212111
nó rất là hay nha mọi người mọi người hãy tải về đi nó rất là hay,0.22455331915222584,0.3085901595020013,0.46685652134577277
chơi rất hay vui không cần chơi được vui lắm thử tải đi,0.21499314978789455,0.3825757057278931,0.40243114448421224
hay nhanh tay le mất,0.3438887456183754,0.3145207447397912,0.34159050964183346
hay phết đấy i like very very,0.20710610182301376,0.2928103340764301,0.5000835641005562
nó rất hay và vui thế nên cho sao và rất hài lòng,0.18389983382044753,0.1901270047233083,0.6259731614562442
pha dao tro nay roi,0.3064282924945259,0.3620235395711,0.33154816793437414
ch không ăn vàng là nha,0.33576931242647967,0.35151850507559707,0.31271218249792315
game này ối dồi ôi luôn quá hay,0.3784767547078207,0.21001620165454526,0.41150704363763413
tôi rat game nay,0.2510909052303311,0.2377095810882559,0.511199513681413
chơi rất hay và hết,0.24965904170503617,0.2705243609403238,0.4798165973546399
game chơi rất là hay,0.18348609675344502,0.3785153580145448,0.4379985452320102
nó rất thú vị nó giúp tôi có một thị giác tốt hơn,0.22958735875356723,0.3084478712902303,0.46196476995620245
trò chơi này rất vui tôi rất ưng ý cho năm sao,0.27185165036862485,0.2737710665984751,0.4543772830329001
quá good i love game,0.2056600540303367,0.19733750590468327,0.59700244006498
bởi vì nó hay và vui,0.18511159106616226,0.3531721497323683,0.4617162592014695
có những mấy con nhân vật khác mà cũng hay,0.24609656976337718,0.3216752463400559,0.4322281838965669
làm cho mình trở nên tự tin hơn nó thật có ích,0.32081666939337783,0.3456567191518981,0.333526611454724
ok good game hay,0.17715115303925544,0.2952705414834009,0.5275783054773436
mong rằng mọi người thích nó,0.2568375431504474,0.3102855141972829,0.43287694265226967
trò chơi rất hay và vui,0.20997127598238552,0.2759547509732824,0.5140739730443321
ha hay toi rat,0.21272375210170227,0.2889583005242745,0.4983179473740231
cho choi nay chơi rất hay,0.2297423240523005,0.2550916075484207,0.5151660683992789
rất hay các bạn nên tải về chơi,0.12183851301319705,0.45924622868801923,0.41891525829878373
trò chơi rất vui và thú vị mn nhớ tải về chơi thử nha,0.22482313366553133,0.4248104074320275,0.3503664589024411
tôi cảm thấy rất vui khi chơi trò này,0.32743556035832905,0.24355123606250895,0.429013203579162
hay đồ hoạ tốt,0.23790001201228153,0.29589989524796484,0.46620009273975377
game này rất hay về nhân vật thì có nhưng nhân rất đẹp,0.16705896671587653,0.3043297284851991,0.5286113047989243
rất vui luôn á mn,0.2455469208257968,0.19673575135802718,0.5577173278161761
k còn gì để nói ngoài tuyệt vời d,0.24823954327776082,0.14922217540609142,0.6025382813161477
game rất hay và mượt chúng ta k nên xoá nên gỡ cài đặt,0.18485686369192963,0.34976786035898666,0.4653752759490838
rat người nen tai ve choi,0.317439835390156,0.29188908939909847,0.3906710752107455
game sam lon qua đi,0.31645520945504635,0.33824001260206277,0.3453047779428908
hay quá xá là hay,0.26181905056953714,0.21722554797335814,0.5209554014571048
hay lắm mọi người tải về chơi đi,0.2433887597014561,0.4205508791811854,0.3360603611173586
game phải là tuyệt vời rất hay,0.11694536620818918,0.13966519147668205,0.7433894423151287
baby quây mà ghê luôn mà cái ông bác đáng quá ý kiến riêng thôi nha ai mà thích ông bác đó thì đừng có chọi đá tui à nhưng tốt nhất là im lặng bye chế,0.22388726881962734,0.4467574818072521,0.3293552493731204
tro nay rat hay PROFANE hay luôn no minh giai tri mong PROFANE ban ung ho nhiều hon giong nhu minh no không ton nhiều dung,0.19663694494764905,0.3733501455225626,0.4300129095297884
nó chơi rất hay và ý,0.16589029296984725,0.26903531662543856,0.5650743904047141
rất mong th cho thuê,0.2972576768114287,0.29832799156437284,0.4044143316241986
nhung ton nhiều mb qua,0.29813777942503844,0.3357392988040863,0.36612292177087524
trò chơi đồ họa đẹp,0.24347636209597284,0.38030559213079657,0.3762180457732307
game khi xưa đồ hoại không được đẹp nhưng hôm nay bước ra là một tượng game được lột xác trở nên tuyệt vời,0.24534586982188497,0.2785647450402144,0.47608938513790056
thật là tuyệt vời các bạn nên tải đi b,0.08275229384854785,0.22612293251959498,0.6911247736318571
chua choi ma hinh cung hay ba dao ha,0.2507454193366351,0.4057470757842776,0.34350750487908743
nó rất là tuyệt,0.132830838291143,0.16943842031182904,0.6977307413970281
game offline và online hay nhất từng chơi,0.22222444298966854,0.38839671807363835,0.3893788389366932
chơi rất vàng khi mua nhân vật,0.2730506835774528,0.29316332071749746,0.4337859957050498
game rất hay tôi rất thích nó,0.17917977542388655,0.19811587913113296,0.6227043454449804
hay trò này tui thích,0.23288102097413516,0.34254221674313406,0.4245767622827309
chưa chơi nhưng thấy ai củng khen ủng hộ,0.318183747390738,0.3185248704363359,0.3632913821729261
roll la lăn lần nhé,0.2430093125905317,0.43779113372566236,0.31919955368380604
no ưu tú khi bú ưu tú high bù khú mom hi in um by chơi it if on tự kỷ it mức mừng mừng mừng mừng,0.3806718921604236,0.30525195152768014,0.3140761563118961
nó hay lắm rất hay,0.22711955258132036,0.2022554401151999,0.5706250073034798
nó cung rất la hay,0.16581363424342357,0.3058191907352321,0.5283671750213442
chò chơi này làm tôi vui vẻ,0.3655934994706444,0.32024804076341057,0.3141584597659451
trò chơi chạy này rất biệt là chú bảo vệ đuổi tí là chú bảo vệ mất chả thấy mặt đâu rất thích nên mình cho năm sao,0.32801593031839715,0.3343508244978353,0.3376332451837675
game choi quá on,0.29741471637301503,0.25865184831242843,0.4439334353145565
tốt nhưng nếu bổ sung nhiều địa hình hơn nữa thì tuyệt vời,0.19950308611332157,0.2425449044879551,0.5579520093987232
khi tôi chơi nó đã làm tiu lời lên,0.25722891408954507,0.4090449346718585,0.33372615123859634
game tốt mà đi đánh sao,0.2378772114512031,0.3918025973525436,0.37032019119625337
trò chơi này rất tên là,0.2621783528093106,0.3694040417958431,0.36841760539484636
tro troi rat hay va tinh,0.37132100294085824,0.2380952055814244,0.3905837914777174
nó rất hay tôi rất thích trò chơi này cho nên tôi cho nó năm sao mãi đỉnh,0.23280885901158924,0.24614822481515006,0.5210429161732608
chi noi cau la tro nay choi rat hay luôn,0.2435577618025567,0.2525563840892871,0.5038858541081562
các bạn thử đi nhé,0.11835503764944315,0.5356013020813394,0.3460436602692174
tôi cực thích game này,0.2566650829790884,0.25813683271910925,0.48519808430180233
thật la you i love you,0.23873147948789775,0.3135705739675266,0.4476979465445757
tôi rất thích trò này nhưng rất la tuyết phải có trò chơi tuyết,0.24575260821296663,0.3116047463872819,0.4426426453997514
moi moi người tai ve ma choi,0.3796012879408258,0.25982142344427317,0.36057728861490107
mình thích trò chơi này,0.20565225002963233,0.3203729290806637,0.473974820889704
hay lắm đó mọi người ơi,0.276413882685067,0.3906175938348707,0.3329685234800623
game như cái lo nhưng tôi thích cái lo nên tôi cho sao,0.3263220148705625,0.3599339169295311,0.3137440681999064
game quá hay chơi rất vui mn nên chơi thử game này nhé và nhớ đánh giá sao cho game nhé game có thể mua ván trượt skin đẹp và nhiều thứ hấp dẫn khác game có khung cảnh đẹp nhiều chướng ngại vật để tăng độ khó cho game game có chú bảo vệ và con chó hung hăng nhiệm dụ khi chơi game này là bạn phải chạy lấy tiền hợp may măn chữ số và nhiều thứ khác bạn còn phải vừa chạy vừa né những chướng ngại vật trong game khi bạn chơi game bạn sẽ có cảm giác thoải mái vui tươi,0.15180233753741643,0.49647955187003223,0.3517181105925513
tui thấy hay bởi tui biết,0.25944229991535983,0.40016379985994815,0.340393900224692
yeah pb moi nhưng bao h moi den,0.41125580729230793,0.2705637208180658,0.3181804718896263
trò chơi này rất hay nhưng hơi bị đơ,0.3971584177618634,0.2204982274603163,0.3823433547778202
rat hay va thu vi,0.24779312725712804,0.29103227995860914,0.4611745927842629
no rat hay va lay nhung hinh va phong phu,0.31997743374132553,0.32391542876116447,0.35610713749751005
mình rất thích trò này các bạn nên tải về chơi,0.10730895806280501,0.3923340170631881,0.5003570248740068
game chơi rất hay và đồ hạo gam thật đẹp và mượt,0.1335742265948233,0.1927550194592999,0.6736707539458767
nó rất là thú vị và vui nhộn,0.2515818982385365,0.23792735061543469,0.5104907511460289
cho chơ nay rất thu vi,0.24581435270199037,0.27779090417232133,0.4763947431256882
tôi rất hay bị hiện tượng đang định trượt sang hai bên mà tư nhiên nó lại trượt xuống là sao,0.31649285057745935,0.35362756686443925,0.32987958255810135
trò chơi này hay quá đi thôi,0.3146789023741971,0.2634885547331304,0.42183254289267264
hay đấy nhớ sáng tạo ra các game khác nhé,0.15453666647170292,0.4283586598465199,0.41710467368177717
quá hay luôn,0.2939445699525322,0.16729125022392813,0.5387641798235397
tro nay choi rat vui va thu vi,0.2711078070507175,0.2627110187784667,0.4661811741708158
hay và bổ ích chấm s ok,0.2160791008322105,0.243212161949214,0.5407087372185756
chơi rất vui nó đã giúp tôi nhanh tay hơn tôi rất thích,0.2140396187679213,0.20990068348824314,0.5760596977438355
là một trải no mới,0.2326278474128648,0.3691872151844296,0.3981849374027056
chạy vẫn không mệt mấy đứa nhân vật này chắc tụi bó,0.3486548703706265,0.3187942865573048,0.33255084307206867
game tạo ra vàng cho người chơi chơi né vàng,0.253765580655762,0.4347647586395171,0.3114696607047209
tuyệt vời mà đổi đt khác chơi đăng nhập nó k lưu mong ad điều chỉnh lại,0.1561187084436483,0.3539406710194154,0.4899406205369362
ok thủ đô hà nội voi,0.2311857973374897,0.2779219149857607,0.4908922876767497
không hiểu sao mình lại phá đảo luôn xa nhất,0.4186703416056273,0.2379574740471561,0.34337218434721667
quá tuyệt vời nhưng tôi mong ad sẽ có nhiều hơn nữa những cải tiến để giúp người chơi thích thú hơn,0.2566382343928728,0.2717177277721748,0.47164403783495235
tôi rất thích trò chơi này tôi chơi trò này từ lúc tôi còn học mẫu giáo,0.3147065596225346,0.28484978781030285,0.40044365256716263
chơi quá vui ta sẽ chịu đang hé thống gần hà ha bà đi bà ghen kế hèn hạ em ham ngầm ts điểm mẹ dặn đây,0.31215548905768015,0.32570973928451263,0.36213477165780716
game này hay very good,0.22032634517420344,0.28047685590440213,0.4991967989213945
có vài má vô đánh giá game với cập là game rất hay nên mình cho game làm vậy chi mấy má vô duyên cứ tưởng hài,0.28069190194675214,0.38543589942955975,0.33387219862368805
dang thu không biết không nua,0.34383133881027345,0.3112374617601668,0.3449311994295597
quá hay cảm ơn nhóm tác giả,0.3414489525274044,0.25217684674796564,0.40637420072462993
game hay và rất thú vị,0.2687743032249116,0.29150077574613054,0.4397249210289579
tôi thấy cái trò chơi này rất là thú vị,0.3634252393264669,0.3020163713615915,0.3345583893119417
thoải mái and thư giản,0.23177734412666648,0.41136419309391387,0.35685846277941957
game rất vui t rất t,0.22289809589850734,0.2244810811238466,0.5526208229776461
rất là hay mang tính chất giải chí,0.18108433579717162,0.30559929489377263,0.5133163693090557
trò chơi rất tuyệt các bạn nên tải về đi nhé,0.09200009730420448,0.378179510889396,0.5298203918063994
tuyệt vời tôi muốn có thêm nhiều hình khác nhau nhiều màu sắc thì tôi sẽ có hứng thú hơn,0.3079135658289,0.25131510410624447,0.44077133006485547
cũng rất là luôn tải đi bà con ơi,0.22921570714848089,0.293856303203554,0.47692798964796507
game này rất hay và giải trí đoạn đường dài vô tận,0.3424836038330151,0.2609656126535547,0.3965507835134302
