tokens,neg_score,neu_score,pos_score
game hay và tôi đã có tuổi thơ thật dữ dội,0.2849281716874009,0.3376191030299556,0.3774527252826435
ok cái trò này cũng hay đấy,0.24286906801074473,0.2708836763220841,0.48624725566717114
thật voi cho sao,0.3135770542869549,0.3665076563209917,0.31991528939205344
cu cập nhất nhiều vao nhung dung cập nhất nhanh qua vi the ma toi,0.26733897018727715,0.30924637111555126,0.42341465869717154
game này chơi rất là vui nghĩ các bạn nên tải về chơi,0.12648490305536034,0.5149208580810465,0.3585942388635932
rat va choi rat rat hay,0.26974091397595656,0.19733770675247472,0.5329213792715687
chay den noi re đâu,0.3030358989742637,0.28929701997694096,0.4076670810487953
các bạn nên tải game này,0.14095919148148245,0.522634256411569,0.33640655210694853
kỷ lục của mình là mình,0.287347685567315,0.2878431194116566,0.42480919502102854
game rất hay nên tôi sao,0.26396726106386814,0.3640562076470946,0.3719765312890371
chơi rất tốt không lag tý nào,0.238813279184651,0.27633582703521964,0.48485089378012924
chơi rất vui mang tính chất giải trí,0.1890883867840426,0.3133310504641889,0.4975805627517686
game nay rat hay ad cho them vai nhan vat di,0.28503944243722124,0.3462501335158339,0.3687104240469449
trò chơi này rất thú vị,0.3256113826545211,0.29891894382566797,0.375469673519811
bé nhà mình rất khoái trò này,0.22777617164294556,0.2089963006287482,0.5632275277283064
hai tai ve choi di PROFANE bang,0.3103869443193876,0.3533302778733417,0.33628277780727067
tro choi nay thật bo cho su tinh cua lua nho,0.42683085825758244,0.255597671658632,0.3175714700837855
chơi với bạn bè của mình là hết sẩy con bà,0.23108117731113023,0.423920566640101,0.3449982560487687
hay nhung tai lau qua di a,0.3473947532020808,0.26937494744418006,0.3832302993537391
hay mà chơi hơi lag mong sửa lại dùm mình và tất cả máy khác,0.3775804843763682,0.2727582963031423,0.3496612193204895
game này rất hay nha mn,0.22804091799601667,0.30983142423530763,0.4621276577686758
tôi rất thích game này nó còn giúp tôi giảm stress nữa,0.2601483243049361,0.3147914414331267,0.4250602342619372
game hay có save lại tốt hơn,0.20901467438070723,0.4051745503287165,0.38581077529057634
hay hay hay hi hu,0.2845343758224659,0.356085736297456,0.3593798878800781
toi choi tro nay da nam nay,0.2895562690819828,0.3010234436412752,0.4094202872767421
chua choi nhung thay hay cho,0.34198801996222467,0.33585953961907083,0.32215244041870456
tam được tai ve choi di,0.29446177760321124,0.32978849870171434,0.3757497236950745
hay toi noi toi ngu nam mo luôn,0.3163198084786019,0.30132232263974595,0.3823578688816522
hay quá mình rất thích trò này,0.18571157999846438,0.14026746655321912,0.6740209534483165
cập nhật nhìu thấy bực lắm,0.40260028464223774,0.26072606342649063,0.3366736519312716
hay qua cho sao luôn,0.33273060290178763,0.327818122938857,0.3394512741593553
hay quá ba con,0.24303996993279908,0.23950809638269446,0.5174519336845064
very không thể mong nhà sản xuất ra nhiều chướng ngại vật hơn,0.28846467637175693,0.377418492398709,0.3341168312295341
hay quá tôi trơi có lúc rất cay đắng,0.32758647821013914,0.21628507022534307,0.4561284515645178
game k hay chơi như tôi rất rất và rất thích chơi k phải tôi bấm đâu nha má hay quá à nhầm,0.21251084783027446,0.2630869740892725,0.524402178080453
game này rất ưng ý và rất hay,0.22158456551452033,0.17874135652581127,0.5996740779596683
ban co choi voi minh,0.21909723976933856,0.4654788655338824,0.3154238946967789
khá biết ai phá được kỉ lục vàng trận như mình,0.29561927545731176,0.3337736455847091,0.37060707895797906
trò hay chơi cũng vui,0.3036242870741129,0.35517637472171726,0.3411993382041698
game rất giải chí nên cho,0.22617009539441646,0.4049242645575832,0.3689056400480004
game rất tuyệt vời và mn nên xem lại mạng của nhà mình đừng vội đánh dá sao sao sao cho game này tôi thấy game này rất hay đấy,0.15489248597745095,0.35439941785856555,0.49070809616398353
sai rui nhan hai lan được s dung van,0.29347986162737383,0.32198583799236397,0.3845343003802623
chò chơi này khá thú vị với trẻ em hiện nay,0.27191966031767073,0.28605140895442516,0.4420289307279041
trời hay với cả không có nã vẫn trôi,0.3894756330608073,0.29567786121811396,0.31484650572107886
yêu hay mn đùng tải nha,0.19716089116968322,0.4208131419979483,0.38202596683236845
game rất hay nhe nên chơi,0.1708847665574892,0.3702659517175142,0.45884928172499667
hay tôi muốn ra thêm nhân vật và đồ hoạ đẹp nữa nhé,0.22315337311402286,0.3264020639381658,0.4504445629478113
game này khiến tôi rất vui,0.29641996020758987,0.3035328329346082,0.4000472068578019
tất nhiên là rất vui,0.21671375908111176,0.298538249731428,0.4847479911874602
tôi đã rất thích thú,0.290319085614582,0.14525858740123285,0.5644223269841852
chơi rất hay nên tải về máy thôi các bạn,0.1623416475068303,0.4134375852229105,0.42422076727025915
game hay đấy mình chơi rồi,0.20820999341367669,0.43635927572224387,0.35543073086407945
không nói sao quá đỉnh xịn cức,0.318537310010058,0.15977402437769542,0.5216886656122465
tốt tôi thích chơi trò này,0.18925894789508715,0.2633315050028924,0.5474095471020204
trò choi vui nhộn hấp dẫn,0.25447810310997676,0.3598645746986845,0.38565732219133864
tro nay rat hay nhung toi thay tro,0.30989609426106546,0.265646934565387,0.42445697117354764
em rất thích chơi game này,0.16698153739641566,0.2649348847597603,0.568083577843824
tốt game hay vậy,0.14666362054417245,0.4138474411050167,0.4394889383508109
game hay mượt đồ hoạ đẹp,0.19521297941404786,0.2793420497370666,0.5254449708488856
chơi trò này rất vui,0.26429108837652593,0.2854499968197252,0.45025891480374886
game này rất hay và vui cho những trẻ trẻ nhỏ tui chơi cũng lâu rồi nhưng chơi lại cũng rất vui,0.2396548521173346,0.33945843494534433,0.4208867129373211
rat co hoan nua,0.236334402119983,0.30038709704828054,0.46327850083173633
game giải trí rất tốt,0.11540574113769897,0.23895254635540855,0.6456417125068924
game rat game rat nhung chinh do hoa lai một la được,0.25354020198613614,0.3373145744036585,0.40914522361020556
trò chơi này vui cực kì luôn nên cho sao,0.326882151226015,0.35520179005234787,0.31791605872163725
good sao luôn very very good,0.24856646614128405,0.25011014508253804,0.501323388776178
game rất hay và nó đã giúp tôi trở lại với tuổi thơ hồi,0.2559864334798151,0.29032850825469725,0.4536850582654878
game này hay mượt nứa,0.21196798825787003,0.3280516954944757,0.45998031624765434
tôi rất yêu t chò này vì nó rất vui,0.21327563262613994,0.21946104062285843,0.5672633267510017
game rất vui luôn có lỗi nhỏ là nhìu khi lướt không được gây ra bị bắt oan,0.3531518813702104,0.32569938503168216,0.3211487335981074
hay quá chơi miết mà k chán,0.42813710562855956,0.24218241169145663,0.32968048267998373
tro nay rat hay tuy la hay bi nhung toi van thay hay,0.2808776985622133,0.24755289629930072,0.471569405138486
nhung mà game này chạy k có đích à,0.25400007495386073,0.4271810679048225,0.3188188571413166
sức khỏe mấy con nhân vật khá quài không mệt,0.2627765105385517,0.4218085756162647,0.31541491384518344
game tập tính nhanh nhẹn rất tốt,0.07665197556120865,0.2360371868087313,0.6873108376300601
game tuyệt vời luôn nó giúp mình trở lại tuổi thơ của mình mong mn sẽ chơi thử,0.17557173872053158,0.2789723723401102,0.5454558889393583
phải nói là t đánh giá được như lông thật,0.3108733514166613,0.31488091214055397,0.3742457364427848
game rat hay,0.20163764869082168,0.2957409868731954,0.5026213644359829
game nhìn nhan vật nứng cặc quá,0.33723874382646996,0.16495361789085597,0.49780763828267394
cái trò chơi này thật hay,0.30881266368796806,0.3544274125011903,0.3367599238108417
rất hay va rất tay,0.2092334762414652,0.16847410533173773,0.6222924184267972
đang tai biết hay không cho sao luôn,0.32698529092162326,0.3519974423126914,0.3210172667656852
game rất hay nên tôi cho sao,0.30074873261411483,0.36296507528409294,0.3362861921017922
choi PROFANE ki da luôn nha,0.3434030671183565,0.28854387907792756,0.3680530538037159
game xả stress khá tốt tôi cho là,0.23764976967252657,0.33618354030832337,0.42616669001915003
game này rất hay nhưng không đủ tiền mua nhân vật,0.248576406392052,0.32561725228258864,0.4258063413253594
game hay rất hay đã thế còn nhân vật và cả ván trượt nữa rất rất hay,0.23387251273350482,0.24689115019476612,0.519236337071729
tai ve choi di choi hay lam,0.3216164052229859,0.30385012724550897,0.3745334675315052
game rất hay và tạo sự quyết tâm tâm,0.2798524905013006,0.2804747127960118,0.43967279670268766
rat n lo xoa phai tai lai,0.28131649265366737,0.29959739197250157,0.4190861153738311
year year hay quá là hay,0.27401606825232766,0.23794833631029708,0.4880355954373753
chơi rất tốt cho trẻ em,0.17354552485807567,0.23037451311321114,0.596079962028713
game lối chơi tốt giành cho những người có khả năng phản xạ ngón tay rất nhanh như tôi,0.2268949593451263,0.3591665607301675,0.4139384799247062
chị cho em tải trò này nha,0.23782144683739367,0.43458936740014,0.3275891857624662
game này rất là hay nhưng không tải được nữa,0.23902435829377114,0.3525616568431852,0.40841398486304353
game thực sự quá là hay luôn nha mn lên tải về,0.31598978029798896,0.2741104409955381,0.409899778706473
rất vui và thú đầu chơi thấy chán lát sau thấy vui vui,0.38475265528872465,0.2758348168202663,0.3394125278910091
game hay cho e nhé nhân vật đẹp và quà nhiều tôi đánh giá sao,0.19930988669096966,0.3824545990121768,0.4182355142968536
chơi rất cần nhiều bộ nhớ qua,0.23275525450353476,0.3792091628566579,0.38803558263980736
game cần kĩ thích,0.20310271661846088,0.42403491203707955,0.37286237134445954
tôi đã chạy được và nhận được coin đầu tiên,0.3093038794574135,0.30677795839530075,0.3839181621472857
cập nhất ma pi loi hoai la sao tr,0.3766774639415577,0.28836281342153247,0.3349597226369098
mong được nhiều choi hon,0.2842779582190123,0.3700519069627877,0.3456701348182
chơi nghiện luôn á mn,0.2283061717093222,0.4168315385228494,0.3548622897678284
chạy chậm quá nhưng hay cho vì quá hay,0.3992166609746142,0.22107896683690603,0.3797043721884798
i very love thật,0.22172604725360268,0.20923856586051773,0.5690353868858796
chơi trò chơi rất vui vẻ,0.2518141636815067,0.34860392494687115,0.39958191137162213
chò này khá là hay và có thể những người đang tức giận có thể chơi trò này tôi mong là trò này có thể cho anh cs đồ mới và cho hai con chó nữa,0.2773184686970594,0.3605011562112412,0.36218037509169937
ôi xuất sắc mẹ luôn,0.31608731158997516,0.3208112332671906,0.36310145514283415
ai game thi choi cho vui,0.292244220983601,0.38859874057396393,0.319157038442435
tôi không tải nó được nhưng tôi cũng trải nghiệm ứng dụng này rồi tôi cảm thấy nó và khi chơi nó làm chúng ta có thể giảm căng thẳng rất tốt,0.27929153337643003,0.22810403097368498,0.492604435649885
toi thay game rat hay tu hao nay mong nha san co nhiều nhan vat hon sin cam on,0.21700640106340838,0.3765735604266219,0.40642003850996977
game hay lên chơi xứng đáng sao nhé mn,0.21777661144541544,0.45415656952064726,0.32806681903393725
trò chơi này thật sự rất tuyệt,0.24619740752781336,0.1965268734975247,0.557275718974662
game hay và có thể luyện tay tốt,0.15890663617953132,0.39936263841933384,0.4417307254011348
chơi hay và rất cuốn hút người chơi các bạn đã chơi thử chưa mình thích trò chơi này,0.16413770240265477,0.35816863072079586,0.47769366687654924
hay lắm các p ạ,0.24975193892343622,0.30881231044694096,0.4414357506296227
hay se tip day,0.3150513940931649,0.33644896291852955,0.34849964298830544
choi rat vui chi co ai không biết choi thoi,0.32365089472312203,0.3339740931013286,0.34237501217554933
toi trat tro nay,0.33696984834912164,0.29941775286764727,0.3636123987832311
game này rất hay rất thít,0.2141947701482763,0.2133637769067509,0.5724414529449727
game nay bao hay hay vai teo,0.30642054684017206,0.37974903755079137,0.31383041560903663
không can ma van được qua hay,0.31402734788765907,0.3273867739124106,0.3585858781999305
rất hay không trừ tiền,0.25417351641018915,0.27525144608558416,0.47057503750422686
rất tuyệt vời đó nha,0.11770521887077778,0.16556149213079802,0.7167332889984243
hay lam day moi người cung choi nhe,0.27081344441857536,0.33548664407256235,0.39369991150886235
rất hay thế nên mình cho năm sao luôn,0.23439599577422857,0.37809937866786675,0.3875046255579046
tôi rất thích trò này vì nó rất hay,0.18371326069056315,0.1764678979980326,0.6398188413114042
chưa chơi nhưng có vẻ hay,0.2276867377024813,0.4263731325067603,0.34594012979075844
hay nhung choi hoi thay,0.3256856787159715,0.3171702744576774,0.3571440468263511
không có từ nào để diễn tả ngoài tuyệt vời,0.25480641562363787,0.24395813784450868,0.5012354465318534
game rat hay toi rat,0.22519012512642636,0.2543578349808734,0.5204520398927001
chơi rat vui anh em nho choi nha,0.21314010273748488,0.3732996379671032,0.413560259295412
trò này rất là hay hãy cùng chơi đi,0.2959752036499909,0.3098480288553227,0.39417676749468644
tôi là cực kỳ thích game này vì nó hay luyện được tay nhanh nhẹn hơn,0.23865642332724443,0.3045175681852014,0.4568260084875541
mạng của các bạn chậm nên tải lâu,0.20569727286228898,0.40584265335607506,0.3884600737816361
mình đồ sướng vãi,0.1997098336115477,0.2780922040918854,0.5221979622965669
tro nay hay lam tai ve choi,0.32026118451268004,0.28143947825148274,0.3982993372358371
game chơi rất vui và có tính giải trí cao nên khuyến khích các bạn tải về chơi còn không thích thì thôi nha các bạn,0.14789695434683528,0.5266065574794359,0.32549648817372884
choi được nhung dung hoai a,0.32273095509237876,0.2821538631363022,0.3951151817713191
chung toi rat tro choi nai,0.3042380411152299,0.24687892930462,0.4488830295801501
game của các chiến thần,0.27701525741438593,0.39646509653664064,0.3265196460489734
game nay rat hay hay hay,0.23268860637556238,0.31283159889562157,0.4544797947288161
mí hãy tải về thử nhé,0.21797822090640948,0.4566135482313032,0.32540823086228726
tro nay hay va thu vi,0.28090994516261125,0.3192249394410497,0.3998651153963392
chơi không mạng được là được r với lại mình thấy game này cũng hay,0.25106271371132066,0.3400253893271331,0.4089118969615462
trò này hay thật các bạn ạ mà chơi cái này không ăn kim cương thế mới đau chứ bị các bạn ơi thế mà ngờ chò trơi này có tận hơn tỉ người chơi thế này thì quả thật là công sức tận năm thì phải nhỉ các bạn,0.22502060625378428,0.4372664052790624,0.33771298846715325
hay nên tải về chơi,0.1937623299708828,0.4789983971057875,0.3272392729233297
tro choi nay rat voi,0.25793555952479774,0.25690897808208657,0.4851554623931156
tro choi nay rat vui va hay,0.2975455240831755,0.21434124742913246,0.488113228487692
rất vui nên tui rất,0.19144480433884414,0.25989709663617083,0.5486580990249851
game nay lúc ben choi den x sang note choi lai tu street voi kill time ok lam,0.23913194382910408,0.30430419958926747,0.45656385658162846
cái này là phiên bản mới hả mn,0.26217552051321147,0.39217914368965534,0.3456453357971332
hay lam tai di,0.3065781715143573,0.3259605392164365,0.36746128926920624
mình rất thích trò này vì nó vui và có thể giải trí nói trung là rất hay,0.158605422490664,0.1973277152565451,0.6440668622527909
mình chơi game này khá dễ,0.207830608931289,0.3971707682854169,0.3949986227832942
game hay lam tai ve choi di oi,0.27019931339397474,0.355064172362883,0.3747365142431422
ok hay đôi lúc tốc độ nhanh quá khiến mình như đang chạy ở ngoài đời thực,0.31568523190921804,0.25135236950722456,0.43296239858355745
hay tro nay dang de po ra taj,0.29369471566000216,0.3440784083104927,0.36222687602950515
rất tốt tôi cũng đã thích game này là của tui,0.21090781789284266,0.20663937473053043,0.582452807376627
chơi này chơi rất hay mình thích nhất là cái phần âm nhạc,0.22566154956474155,0.2713927741744286,0.5029456762608299
thật tuyệt vời,0.117617402334223,0.08780441232389294,0.7945781853418841
tro choi rat hay va vui nhon,0.3104941958328508,0.23663532618686617,0.45287047798028285
choi hoai ma k chan,0.3480208699496665,0.3284394640392612,0.32353966601107237
hay và phê như bánh mì patê,0.25739840428548555,0.286260996422476,0.4563405992920386
trò chơi thì giảm stress rất mình cũng rất thích,0.18038087366108352,0.2787887102745664,0.54083041606435
trò đó rất như thật luôn game này có phiên bản mới luôn nha đẹp quá rõ lắm,0.23105887819284643,0.21896169590356046,0.5499794259035932
game rất hay nhưng cần nhiều thêm nhận vật hơn nữa và giảm ít vàng xuống một chút,0.27458103198364825,0.3220210958169794,0.40339787219937223
ad có thể làm rẻ hơn chút được k,0.18273038499687344,0.4460927915784458,0.3711768234246808
hay toẹt cú mèo luôn,0.32891391843004514,0.29463479007626214,0.3764512914936926
game rất hay nên mình cho sao,0.2130247006234568,0.4061286526245557,0.38084664675198737
choi rat hay nhung bi lag,0.40571264481448965,0.24298152099255582,0.3513058341929546
mấy ông chơi k ăn vàng mà múa ghê qué,0.27713952360435334,0.3902813662608924,0.33257911013475433
game quá gì là hay luôn ai biết thì cư tải,0.3066748556813194,0.32157112494279483,0.3717540193758857
trò chơi rất hay nhưng cũng rất khó,0.328843282985024,0.2607075901811458,0.4104491268338301
quá phê phê tê tê sót sót,0.2531870827955559,0.226075143464756,0.5207377737396881
cực hấp dẫn và kỳ diệu PROFANE,0.21908015457162128,0.26033462075369795,0.5205852246746807
quá hay luôn tập phản sạ tốt phết,0.1734097065550887,0.18234475544134732,0.644245538003564
hay nhưng mà mỗi khi mất mạng là nó cứ giật,0.4141301424887287,0.2757668167542851,0.3101030407569863
game lan nay tuy chua coi bih moi thay thi da nen tai ve moi được,0.311262980206723,0.3043578079805802,0.3843792118126968
trò này phải nói là rất rất tuyệt khi nào nhà phát hành mới cho ra trò mới vậy,0.23843281859442259,0.3070498133891204,0.454517368016457
hay họa vụ hay nhưng có bản tiếng việt thì tốt,0.23472106180681437,0.44618465789307915,0.3190942803001064
siêu không thể cưỡng nỗi,0.3288067367295457,0.29885771481576295,0.3723355484546914
quá hay rat ung dung nay,0.23989948441095768,0.1460935917051659,0.6140069238838765
bản mới đẹp và chân thật hơn bản cũ,0.24944797155841686,0.24814677851694494,0.5024052499246383
đừng cập nhật nhiều quá,0.363900500058778,0.3127839081222283,0.3233155918189936
game này tôi thấy rất hay,0.2504194539188372,0.2813052452893481,0.4682753007918148
hay không tả nổi luôn,0.3228106698130747,0.2546914781406717,0.42249785204625356
hay và rất tuyệt vời cảm ơn người đã xuất ra trò chơi,0.1696459267399672,0.2112039359264537,0.619150137333579
tro choi rat hay do hoa va de choi,0.3788227578831397,0.2725088672007126,0.3486683749161477
trò choi nay rat hay,0.26656996799070887,0.22528908881649393,0.5081409431927971
game này lúc nào cũng hay,0.3340018568299649,0.2877760420406512,0.3782221011293838
chơi vui nhộn làm cho tinh thần vui hơn làm cho trẻ em sản khoái,0.35071498836079185,0.3066227632224249,0.3426622484167832
rất hay có tính giải trí cao,0.20533950095238085,0.3221996557612919,0.47246084328632726
rat vui ma con ren su nhanh tay va su kheo leo nua ok,0.26278067077288925,0.29258034052478277,0.44463898870232815
nếu mà có ai chơi trò chơi này thì cảm giác rất vui,0.30732015264306173,0.34935367912269766,0.3433261682342406
hay nhưng hơi nặng add sẽ sớm giảm nhẹ dung lượng,0.2867275827861832,0.38138095452315973,0.33189146269065706
game rất hay các bạn nên chơi thử,0.11487098181081515,0.49739637302769263,0.38773264516149214
tui lên bộ đồ và ván rồi tui chỉ cần lên tải về là đã sẵn,0.24480730532046954,0.3876441507392334,0.367548543940297
dịch vụ phiên bản mới cha mẹ con cái gì rên em sinh cho anh moi gia dinh song song đó là bạn của anh em mang lại cho con đi dưới ở nhà đi họp thuế thu nhập cá nhân con đi học nên đánh lộn nửa đầu năm nay có thể nói thật lòng nên lén đi chung minh tai nghe siêu nhỏ chủng bị đập trụ lén m,0.24655591297620963,0.4389216023973084,0.3145224846264821
game này rất hay chơi rất êm và mượt,0.18301232168981674,0.2259564324600848,0.5910312458500985
game rất hay giúp tôi có,0.23750866695374886,0.3355394442896554,0.42695188875659584
hay lắm đấy các bạn hãy tải về mà chơi nhé,0.14541037908993124,0.47877741958142817,0.37581220132864057
ố dề chơi no coin thật khó mà nó ảo diệu,0.2874412733139224,0.3719872052703317,0.34057152141574587
hay lắm ý nhưng hay chết quá v,0.4043055688557846,0.23525614327486366,0.3604382878693517
trò nầy hay ma lam oi tải lam mình rat,0.22260193830118788,0.29808117185433597,0.4793168898444762
tai do đt của các bạn thui,0.24082394120026818,0.41930495051387856,0.3398711082858532
quá không thể cạn được ma game minh hay hết chỗ chê,0.37445307820378,0.2457349700613184,0.3798119517349017
chưa hay cho s luôn,0.31620389020684503,0.31791982681916936,0.36587628297398567
trò chơi này rất vui chơi mà thấy sảng khoái cả lòng a,0.2461693939484009,0.3002239331639612,0.453606672887638
hay và trên cả tuyệt vời,0.1719780814473159,0.18050725645373855,0.6475146620989456
chò này giúp tôi giải stress rất tốt,0.18160684930846324,0.207834617566981,0.6105585331245558
trò chơi này là trò chơi tuổi thơ tôi rất thích,0.25657451270923815,0.34559260077854476,0.3978328865122171
chúng ta làm phanh cho em nó,0.23871927835257226,0.38123781773537474,0.38004290391205314
day la một game voi,0.24190390068649148,0.35619685992916067,0.40189923938434785
nang cập full hết roi rat hay,0.3444860781033722,0.3137298359064155,0.3417840859902124
rất hay k có gì phải chê,0.29948437766984365,0.20734466546424196,0.4931709568659145
tôi đánh giá game này là mức độ cao vì trò này chơi rất vui tôi không còn từ nào để mô tả,0.3589437432309579,0.327249932690052,0.31380632407899006
nó rất là vui luôn nhưng những máy nào yếu sẽ bị đơ một chút nên mg đừng chỉ trích game này nhé,0.25756840254025126,0.3994532139743534,0.34297838348539533
khi chơi có thể nói là nó rất hay có nhiều nhân vật đẹp mắt nó rất hay,0.13877159829594427,0.2449443746789625,0.6162840270250932
very good i love it,0.22083151707074836,0.21090313784935613,0.5682653450798953
tro choi nay rat qua,0.2952970553533611,0.20059120835758323,0.5041117362890557
rất là vui vui vui ha ha,0.21390503864806681,0.3184757809618669,0.4676191803900663
tôi tro choi nay,0.3695712603905141,0.270088814833609,0.3603399247758768
ứng dụng này thật tuyệt,0.26143745725545103,0.14328117222711545,0.5952813705174336
tro choi nay tai lau,0.3803402114487035,0.26677358359950304,0.3528862049517934
hay qua lai con giai ve game nay nen toi danh,0.28751195994247336,0.33050799183734514,0.38198004822018145
game này nhiều các hẻo hén quá,0.28584119827125926,0.3921121892871791,0.32204661244156174
minh moi tai ve chay tu toi gio được tr luôn dung đâu top run,0.25226370661068576,0.32726629388246664,0.42046999950684777
game rất hay đáng để mọi người tải về trải nghiệm,0.25106563414102234,0.2752515077975668,0.47368285806141086
mình rất thích trò này hay,0.1659813338845392,0.164422810907736,0.6695958552077248
má gì muốn chết xứng đáng được sao ok,0.41791903984170536,0.266667558970121,0.31541340118817357
game rất hay và nhà sản xuất cho thêm nhiều nhân vật cho thêm vài ván và những map mới nhất của,0.2165386690499108,0.3355089373161174,0.44795239363397177
no rat hay nhi chung nao co ban moi voi,0.19766944919082327,0.35683811429570006,0.4454924365134767
chỉ có từ chất,0.26122033854167054,0.33926734972922984,0.3995123117290995
map rất hay và giải chí,0.20665152753660398,0.25796480265006744,0.5353836698133285
nếu ad cho thêm tính năng với thì tuyệt vời,0.14765122585335827,0.3324384227388569,0.5199103514077849
ủ ấm cho em gọi da,0.24233516774753275,0.3745640443615972,0.38310078789087004
game rất hay cho sao nha,0.2892255026734446,0.34739923043615567,0.3633752668903996
đây là game tuyệt vời nhất với tôi,0.18450717475925504,0.23384835574129723,0.5816444694994478
rất mong sẽ được chơi nhiều,0.23973031561732755,0.3533731814378798,0.4068965029447927
các bạn nên tải về chơi,0.13464915346913733,0.5447570197645213,0.32059382676634135
